	Title	created_at	URL	text	About_text	Year	Month	Day	Time	Date
324	"Ζελένσκι: ""Η πόρτα του ΝΑΤΟ δεν είναι ανοιχτή για την Ουκρανία"""	15 Μαρτίου 2022 16:05	https://www.news247.gr/kosmos/zelenski-zita-eggyiseis-asfaleias.9562653.html	Για μία ακόμη φορά ο Βολοντίμιρ Ζελένσκι ζήτησε εγγυήσεις ασφαλείας για την Ουκρανία την ώρα που η ρωσική εισβολή βρίσκεται σε πλήρη εξέλιξη. 	ΟΥΚΡΑΝΙΑ	2022	Μαρτίου	15	16:05	2022-03-15 16:05:00
325	Ζελένσκι: Βοηθήστε τον εαυτό σας βοηθώντας μας	15 Μαρτίου 2022 14:08	https://www.news247.gr/kosmos/zelenski-voithiste-ton-eayto-sas-voithontas-mas.9562523.html	Ο Ουκρανός ηγέτης τόνισε πως όλη η Ευρώπη είναι στόχος της Ρωσίας καλώντας τις κυβερνήσεις και τους πολίτες να στηρίξουν ακόμα περισσότερο τη χώρα.	ΠΟΛΕΜΟΣ ΣΤΗΝ ΟΥΚΡΑΝΙΑ	2022	Μαρτίου	15	14:08	2022-03-15 14:08:00
326	Πόλεμος στην Ουκρανία: Νέες εκρήξεις στο Κίεβο - Συνεχίζονται οι συνομιλίες	15 Μαρτίου 2022 06:49	https://www.news247.gr/kosmos/polemos-stin-oykrania-nees-ekrixeis-sto-kievo-synechizontai-oi-synomilies.9562104.html	Εκρήξεις ακούστηκαν στο Κίεβο ενώ ήχησαν σειρήνες στην Οδησσό. Νέο διάγγελμα Ζελένσκι λίγο πριν από την επανέναρξη του τέταρτου γύρου των διαπραγματεύσεων.	ΠΟΛΕΜΟΣ ΣΤΗΝ ΟΥΚΡΑΝΙΑ	2022	Μαρτίου	15	06:49	2022-03-15 06:49:00
327	Πόλεμος στην Ουκρανία: Νύχτα αγωνίας και βομβαρδισμών σε Κίεβο και Χάρκοβο - Συνεχίζονται την Τρίτη οι συνομιλίες	14 Μαρτίου 2022 22:50	https://www.news247.gr/kosmos/polemos-stin-oykrania-nychta-agonias-kai-vomvardismon-se-kievo-kai-charkovo-synechizontai-tin-triti-oi-synomilies.9561834.html	"Μαίνεται το ανελέητο σφυροκόπημα των μεγάλων ουκρανικών πόλεων από τις ρωσικές δυνάμεις. Επανέναρξη διαπραγματεύσεων την Τρίτη εν μέσω παγκόσμιου διπλωματικού ""πυρετού""."	ΠΟΛΕΜΟΣ ΣΤΗΝ ΟΥΚΡΑΝΙΑ	2022	Μαρτίου	14	22:50	2022-03-14 22:50:00
328	"Πόλεμος στην Ουκρανία: Επιστολή Ζελένσκι στην οικογένεια του Brent Renaud - ""Η θυσία του θα εμπνεύσει τον πλανήτη"""	14 Μαρτίου 2022 21:44	https://www.news247.gr/kosmos/polemos-stin-oykrania-epistoli-zelenski-stin-oikogeneia-toy-brent-renaud-i-thysia-toy-tha-empneysei-ton-planiti.9561815.html	Με επιστολή προς τους οικείους του, ο Ουκρανός πρόεδρος εξέφρασε τη θλίψη του για την απώλειά του Αμερικανού δημοσιογράφου που έχασε τη ζωή του στο Ιρπίν.	ΠΟΛΕΜΟΣ ΣΤΗΝ ΟΥΚΡΑΝΙΑ	2022	Μαρτίου	14	21:44	2022-03-14 21:44:00
329	Πόλεμος στην Ουκρανία: Καμία συνάντηση Πούτιν με Μπάιντεν ή Ζελένσκι, λέει το Κρεμλίνο	14 Μαρτίου 2022 20:56	https://www.news247.gr/kosmos/polemos-stin-oykrania-kamia-synantisi-poytin-me-mpainten-i-zelenski-leei-to-kremlino.9561776.html	Δεν υπάρχει καμία συζήτηση σχετικά με ενδεχόμενη συνάντηση του Ρώσου προέδρου με τον Αμερικανό αλλά και τον Ουκρανό ομόλογό του, ανέφερε ο Ντμίτρι Πεσκόφ.	ΠΟΛΕΜΟΣ ΣΤΗΝ ΟΥΚΡΑΝΙΑ	2022	Μαρτίου	14	20:56	2022-03-14 20:56:00
330	Πόλεμος στην Ουκρανία: Ο Ζελένσκι θα απευθύνει ομιλία στο Κογκρέσο την Τετάρτη	14 Μαρτίου 2022 16:52	https://www.news247.gr/kosmos/polemos-stin-oykrania-o-zelenski-tha-apeythynei-omilia-sto-kongkreso-tin-tetarti.9561491.html	Ο Βολοντίμιρ Ζελένσκι θα μιλήσει μέσω βίντεο την Τετάρτη στο αμερικανικό Κογκρέσο, το οποίο δηλώνει πιστό στη δέσμευσή του να υποστηρίξει την Ουκρανία.	ΠΟΛΕΜΟΣ ΣΤΗΝ ΟΥΚΡΑΝΙΑ	2022	Μαρτίου	14	16:52	2022-03-14 16:52:00
331	Επικοινωνία Μητσοτάκη-Ζελένσκι: Αμέριστη η ελληνική υποστήριξη στην Ουκρανία	14 Μαρτίου 2022 12:01	https://www.news247.gr/politiki/epikoinonia-mitsotaki-zelenski-ameristi-i-elliniki-ypostirixi-stin-oykrania.9561229.html	Για την υποστήριξη της ελληνικής κυβέρνησης στην Ουκρανία διαβεβαίωσε ο πρωθυπουργός Κυριάκος Μητσοτάκης τον Βολοντίμιρ Ζελένσκι σε τηλεφωνική επικοινωνία που είχαν την Δευτέρα	ΠΟΛΕΜΟΣ ΣΤΗΝ ΟΥΚΡΑΝΙΑ	2022	Μαρτίου	14	12:01	2022-03-14 12:01:00
332	Πόλεμος στην Ουκρανία: Ο ρωσικός στρατός στα περίχωρα του Κιέβου - Δραματική έκκληση Ζελένσκι	14 Μαρτίου 2022 06:58	https://www.news247.gr/kosmos/polemos-stin-oykrania-o-rosikos-stratos-sta-perichora-toy-kievoy-dramatiki-ekklisi-zelenski.9561017.html	Τα ρωσικά στρατεύματα προετοιμάζονται για νέες επιθέσεις στην Ουκρανία. Ο Ζελένσκι ζητεί εκ νέου επιβολή ζώνης απαγόρευσης πτήσεων. Ο Πούτιν απειλεί τη Δύση.	ΠΟΛΕΜΟΣ ΣΤΗΝ ΟΥΚΡΑΝΙΑ	2022	Μαρτίου	14	06:58	2022-03-14 06:58:00
333	Πόλεμος στην Ουκρανία: Κομβικές συνομιλίες εν μέσω βομβαρδισμών - Αισιοδοξία από τις δύο πλευρές	13 Μαρτίου 2022 22:54	https://www.news247.gr/kosmos/polemos-stin-oykrania-komvikes-synomilies-en-meso-vomvardismon-aisiodoxia-apo-tis-dyo-pleyres.9560854.html	Νέες ειρηνευτικές συνομιλίες τη Δευτέρα ανάμεσα σε Κίεβο και Μόσχα, που εκφράζουν συγκρατημένη αισιοδοξία για κοινά σημεία. Συνεχίζονται οι αιματηρές επιθέσεις με θύματα αμάχους.	ΠΟΛΕΜΟΣ ΣΤΗΝ ΟΥΚΡΑΝΙΑ	2022	Μαρτίου	13	22:54	2022-03-13 22:54:00
334	"Πόλεμος στην Ουκρανία: Πρόοδο στις συνομιλίες βλέπουν Κίεβο και Μόσχα - ""Νέος γύρος τη Δευτέρα"""	13 Μαρτίου 2022 20:35	https://www.news247.gr/kosmos/polemos-stin-oykrania-proodo-stis-synomilies-vlepoyn-kievo-kai-moscha-neos-gyros-ti-deytera.9560679.html	Συγκρατημένη αισιοδοξία για συμφωνία των δύο πλευρών μέσα στις επόμενες ημέρες από τους Ουκρανούς. Για νέες επαφές τη Δευτέρα μιλούν οι Ρώσοι.	ΠΟΛΕΜΟΣ ΣΤΗΝ ΟΥΚΡΑΝΙΑ	2022	Μαρτίου	13	20:35	2022-03-13 20:35:00
335	Πόλεμος στην Ουκρανία: Ο Ζελένσκι επισκέφτηκε νοσοκομείο με τραυματισμένους στρατιώτες	13 Μαρτίου 2022 20:09	https://www.news247.gr/kosmos/polemos-stin-oykrania-o-zelenski-episkeftike-nosokomeio-me-traymatismenoys-stratiotes.9560600.html	"Στο πλευρό των στρατιωτών της Ουκρανίας που τραυματίστηκαν στο πεδίο της μάχης βρέθηκε ο πρόεδρος της χώρας. ""Χάρη σε εσάς, δεν γίναμε σκλάβοι""."	ΠΟΛΕΜΟΣ ΣΤΗΝ ΟΥΚΡΑΝΙΑ	2022	Μαρτίου	13	20:09	2022-03-13 20:09:00
336	Πόλεμος στην Ουκρανία: Αισιοδοξία σε διπλωματικό επίπεδο, νεκροί και τραυματίες στο πεδίο της μάχης	13 Μαρτίου 2022 19:19	https://www.news247.gr/kosmos/polemos-stin-oykrania-aisiodoxia-se-diplomatiko-epipedo-nekroi-kai-traymaties-sto-pedio-tis-machis.9560563.html	Πρόοδο φέρονται να έχουν σημειώσει οι συνομιλίες μεταξύ των δύο πλευρών, μετά από 18 αιματηρές ημέρες πολέμου στην Ουκρανία. Αλλεπάλληλοι βομβαρδισμοί με δεκάδες νεκρούς, μεταξύ αυτών και ένας Αμερικανός δημοσιογράφος.	ΠΟΛΕΜΟΣ ΣΤΗΝ ΟΥΚΡΑΝΙΑ	2022	Μαρτίου	13	19:19	2022-03-13 19:19:00
337	"Πόλεμος στην Ουκρανία: Προειδοποιήσεις Ζελένσκι για ""μάχη μέχρι θανάτου"" αν προσπαθήσουν να καταλάβουν το Κίεβο "	13 Μαρτίου 2022 08:22	https://www.news247.gr/kosmos/polemos-stin-oykrania-proeidopoiiseis-zelenski-gia-machi-mechri-thanatoy-an-prospathisoyn-na-katalavoyn-to-kievo.9560048.html	Η 18η ημέρα του πολέμου στην Ουκρανία βρήκε τους κατοίκους να ξυπνούν ξανά από τις σειρήνες συναγερμού και τους βομβαρδισμούς να μαίνονται σε αρκετές πόλεις. Στενεύει ο κλοιός γύρω από την πρωτεύουσα.	ΠΟΛΕΜΟΣ ΣΤΗΝ ΟΥΚΡΑΝΙΑ	2022	Μαρτίου	13	08:22	2022-03-13 08:22:00
338	Πόλεμος στην Ουκρανία: Εντείνονται οι βομβαρδισμοί - Αεροπορική επιδρομή σε στρατιωτική βάση	13 Μαρτίου 2022 07:21	https://www.news247.gr/kosmos/polemos-stin-oykrania-enteinontai-oi-vomvardismoi-agonia-gia-kievo-kai-marioypoli.9560012.html	Σε στενό κλοιό βρίσκεται το Κίεβο ενώ οι βομβαρδισμοί συνεχίζονται σε μεγάλες πόλεις. Χτυπήθηκε μοναστήρι στο Ντονέτσκ, σύμφωνα με την ουκρανική συνοριοφυλακή. Αναφορές για αεροπορική επιδρομή εναντίον στρατιωτικής βάσης στην πόλη Λβιβ.	ΠΟΛΕΜΟΣ ΣΤΗΝ ΟΥΚΡΑΝΙΑ	2022	Μαρτίου	13	07:21	2022-03-13 07:21:00
339	"Νέο διάγγελμα Ζελένσκι: ""Οι μεγαλύτερες απώλειες της Ρωσίας εδώ και δεκαετίες"""	12 Μαρτίου 2022 15:04	https://www.news247.gr/kosmos/polemos-stin-oykrania-neo-diaggelma-zelenski-aytos-einai-enas-polemos-gia-tin-anexartisia-mas.9559473.html	Ο πρόεδρος της Ουκρανίας, Βολοντίμιρ Ζελένσκι, πραγματοποίησε ένα νέο διάγγελμα και κάλεσε τον πρόεδρο της Γαλλίας Εμανουέλ Μακρόν και τον καγκελάριο της Γερμανίας Όλαφ Σολτς να βοηθήσουν.	ΠΟΛΕΜΟΣ ΣΤΗΝ ΟΥΚΡΑΝΙΑ	2022	Μαρτίου	12	15:04	2022-03-12 15:04:00
340	"Πόλεμος στην Ουκρανία: Έκκληση Ζελένσκι στις Ρωσίδες μητέρες - ""Μην στέλνετε τα παιδιά σας στον πόλεμο"" "	12 Μαρτίου 2022 09:57	https://www.news247.gr/kosmos/polemos-stin-oykrania-ekklisi-zelenski-stis-rosides-miteres-min-stelnete-ta-paidia-sas-ston-polemo.9559309.html	Ο πρόεδρος της Ουκρανίας, Βολοντιμίρ Ζελένσκι ζήτησε από τις μητέρες των ρώσων στρατιωτών να κρατήσουν τους γιούς τους.	ΠΟΛΕΜΟΣ ΣΤΗΝ ΟΥΚΡΑΝΙΑ	2022	Μαρτίου	12	09:57	2022-03-12 09:57:00
341	Πόλεμος στην Ουκρανία: Κλιμακώνουν οι Ρώσοι σε Κίεβο και άλλες πόλεις - Κορυφώνεται το δράμα της Μαριούπολης 	11 Μαρτίου 2022 23:00	https://www.news247.gr/kosmos/polemos-oykrania-klimakonoyn-oi-rosoi-se-kievo-kai-poleis.9559094.html	"Με νέες κυρώσεις εις βάρος της Ρωσίας, απαντούν οι ΗΠΑ. Για ""θετική αλλαγή"" στις συζητήσεις, έκανε λόγο ο Πούτιν. Αναφορές για εισβολή των δυνάμεων της Λευκορωσίας στην Ουκρανία. Τραγικός απολογισμός στην πολύπαθη Μαριούπολη."	ΠΟΛΕΜΟΣ ΣΤΗΝ ΟΥΚΡΑΝΙΑ	2022	Μαρτίου	11	23:00	2022-03-11 23:00:00
342	Πόλεμος στην Ουκρανία: Συμφωνία Ζελένσκι - Μπάιντεν για περισσότερη υποστήριξη στην άμυνα	11 Μαρτίου 2022 20:29	https://www.news247.gr/kosmos/polemos-stin-oykrania-symfonia-zelenski-mpainten-gia-perissoteri-ypostirixi-stin-amyna.9559043.html	Ο Ζελένσκι δήλωσε ότι συμφώνησε με τον Μπάιντεν για περισσότερη υποστήριξη στο τομέα της άμυνας και κυρώσεις κατά της Ρωσίας.	ΠΟΛΕΜΟΣ ΣΤΗΝ ΟΥΚΡΑΝΙΑ	2022	Μαρτίου	11	20:29	2022-03-11 20:29:00
343	"Ζελένσκι: ""Η Ρωσία έχει αναπτύξει Σύρους μισθοφόρους στην Ουκρανία"""	11 Μαρτίου 2022 15:42	https://www.news247.gr/kosmos/zelenski-i-rosia-echei-anaptyxei-syroys-misthoforoys-stin-oykrania.9558701.html	"Ο Ουκρανός πρόεδρος κατηγόρησε τη Ρωσία για επίθεση κατά ανθρωπιστικού διαδρόμου ενώ ο Πούτιν επιμένει από την πλευρά του πως υπάρχουν ορισμένες ""θετικές αλλαγές"" στις συνομιλίες."	ΠΟΛΕΜΟΣ ΣΤΗΝ ΟΥΚΡΑΝΙΑ	2022	Μαρτίου	11	15:42	2022-03-11 15:42:00
344	Διχασμένοι οι Ευρωπαίοι ηγέτες για το εμπάργκο στην ενέργεια της Ρωσίας	11 Μαρτίου 2022 09:32	https://www.news247.gr/kosmos/dichasmenoi-oi-eyropaioi-igetes-gia-to-empargko-stin-energeia-tis-rosias.9558199.html	Μοχλός πίεσης προς τον Πούτιν οι εισαγωγές ενέργειας από τη Ρωσία. Οι αρχηγοί κρατών και οι κυβερνήσεις που τάσσονται υπέρ του εμπάργκο. Στο τραπέζι μέτρα που μπορεί να ανοίξουν τον δρόμο για την κατάπαυση του πυρός.	ΠΟΛΕΜΟΣ ΣΤΗΝ ΟΥΚΡΑΝΙΑ	2022	Μαρτίου	11	09:32	2022-03-11 09:32:00
345	Πόλεμος στην Ουκρανία: Η Μολδαβία ανησυχεί ότι θα είναι η επόμενη - Αποκαλυπτικός χάρτης	10 Μαρτίου 2022 17:06	https://www.news247.gr/kosmos/polemos-stin-oykrania-i-moldavia-anisychei-oti-tha-einai-i-epomeni-apokalyptikos-chartis.9557465.html	Ανησυχία και ανοιχτά ερωτήματα έμειναν μετά την αδιέξοδη συνάντηση του Ρώσου ΥΠΕΞ Λαβρόφ με τον Ουκρανό ομόλογό του Κουλέμπα. Η στάση της Μολδαβίας έναντι της ρωσικής εισβολής.	ΡΩΣΙΑ	2022	Μαρτίου	10	17:06	2022-03-10 17:06:00
346	"Νέο μήνυμα Ζελένσκι: ""Δεν γίναμε σκλάβοι και δεν θα είμαστε ποτέ"""	10 Μαρτίου 2022 14:40	https://www.news247.gr/kosmos/neo-minyma-zelenski-den-giname-sklavoi-kai-den-tha-eimaste-pote.9557352.html	"Την ευγνωμοσύνη του σε όσους ""ρίχτηκαν"" στον πόλεμο και υπερασπίζονται για 15η ημέρα την Ουκρανία, εξέφρασε στο νέο του διάγγελμα ο Βολοντίμιρ Ζελένσκι. ""Δεν γίναμε σκλάβοι"", διαμήνυσε."	ΠΟΛΕΜΟΣ ΣΤΗΝ ΟΥΚΡΑΝΙΑ	2022	Μαρτίου	10	14:40	2022-03-10 14:40:00
347	Μαριούπολη: Δορυφορικές εικόνες πριν και μετά τους βομβαρδισμούς	10 Μαρτίου 2022 13:18	https://www.news247.gr/kosmos/marioypoli-doryforikes-eikones-prin-kai-meta-toys-vomvardismoys.9557228.html	Περισσότεροι από 1.000 πολίτες έχουν σκοτωθεί από τους ρωσικούς βομβαρδισμούς σύμφωνα με τον δήμαρχο της Μαριούπολης, στον απόηχο των επιθέσεων σε κατοικημένες περιοχές της πόλης.	ΠΟΛΕΜΟΣ ΣΤΗΝ ΟΥΚΡΑΝΙΑ	2022	Μαρτίου	10	13:18	2022-03-10 13:18:00
348	Στο Στόμα του Λάκη - Podcast: Το παράλογο της Ανδραβίδας, ο Ζελένσκι στα Pandora Papers κι ο Μητσοτάκης να πετάει αετό	10 Μαρτίου 2022 10:01	https://www.news247.gr/lakis-lazopoulos/sto-stoma-toy-laki-podcast-to-paralogo-tis-andravidas-o-zelenski-sta-pandora-papers-ki-o-mitsotakis-na-petaei-aeto.9555977.html	"""Στο Στόμα του Λάκη"" αυτή τη βδομάδα: Η αλλαγή στάσης των Ευρωπαίων στην Ουκρανία, οι λογαριασμοί που ισούνται με τρεις συντάξεις και η λαϊκή αυτογνωσία κόντρα στην αστική αυτοπεποίθηση."	ΛΑΚΗΣ ΛΑΖΟΠΟΥΛΟΣ PODCAST	2022	Μαρτίου	10	10:01	2022-03-10 10:01:00
349	"Πόλεμος στην Ουκρανία: Σφυροκόπημα εν μέσω διπλωματικού ""πυρετού"" - Περικυκλωμένο το Κίεβο"	10 Μαρτίου 2022 06:44	https://www.news247.gr/kosmos/polemos-stin-oykrania-sfyrokopima-en-meso-diplomatikoy-pyretoy-perikyklomeno-to-kievo.9556813.html	Αναφορές για νέους βομβαρδισμούς κατά τη διάρκεια της νύχτας, με τις ρωσικές δυνάμεις να έχουν συγκεντρωθεί γύρω από την πρωτεύουσα. Κρίσιμη συνάντηση των δύο ΥΠΕΞ στην  Αττάλεια.	ΠΟΛΕΜΟΣ ΣΤΗΝ ΟΥΚΡΑΝΙΑ	2022	Μαρτίου	10	06:44	2022-03-10 06:44:00
350	Ουκρανία: Δεν εγκαταλείπουν το Κίεβο ο πρόεδρος Ζελένσκι και το επιτελείο του	10 Μαρτίου 2022 00:45	https://www.news247.gr/kosmos/oykrania-den-egkataleipoyn-to-kievo-o-proedros-zelenski-kai-epiteleio-toy.9556754.html	Διαψεύδονται οι πληροφορίες σύμφωνα με τις οποίες το επιτελείο του Βολοντίμιρ Ζελένσκι έχει εγκαταλείψει το Κίεβο. 	ΟΥΚΡΑΝΙΑ	2022	Μαρτίου	10	00:45	2022-03-10 00:45:00
351	Πόλεμος στην Ουκρανία: Προ των πυλών του Κιέβου οι Ρώσοι-Ετοιμος για συμβιβασμό ο Ζελένσκι 	09 Μαρτίου 2022 22:56	https://www.news247.gr/kosmos/polemos-stin-oykrania-epetai-i-megali-machi-kievoy-etoimos-symvivasmo-zelenski.9556654.html	Ο ρωσικός στρατός συγκεντρώνει μεγάλη δύναμη πυρός γύρω από το Κίεβο με σκοπό την κατάληψη της πρωτεύουσας της Ουκρανίας.  Οργανώνουν την αντίστασή τους οι Ουκρανοί. 	ΠΟΛΕΜΟΣ ΣΤΗΝ ΟΥΚΡΑΝΙΑ	2022	Μαρτίου	09	22:56	2022-03-09 22:56:00
352	Μαριούπολη: 17 τραυματίες από την επίθεση στο νοσοκομείο Παίδων, λένε οι Ουκρανοί	09 Μαρτίου 2022 22:14	https://www.news247.gr/kosmos/marioypoli-17-traymaties-apo-tin-epithesi-sto-nosokomeio-paidon-lene-oi-oykranoi.9556636.html	Ο πρώτος απολογισμός της επίθεσης σε νοσοκομείο Παίδων στη Μαριούπολη, κάνει λόγο για 17 τραυματίες. Καταδικαστέα η πράξη από τον ΟΗΕ και τη Δύση.	ΠΟΛΕΜΟΣ ΣΤΗΝ ΟΥΚΡΑΝΙΑ	2022	Μαρτίου	09	22:14	2022-03-09 22:14:00
353	Ζελένσκι: Ναι στο συμβιβασμό, όχι στην προδοσία	09 Μαρτίου 2022 22:08	https://www.news247.gr/kosmos/zelenski-nai-sto-symvivasmo-ochi-stin-prodosia.9556638.html	Πρόθυμος να φτάσει σε συμβιβασμό με τον Βλαντίμιρ Πούτιν έτσι ώστε να τερματιστεί ο πόλεμος στην Ουκρανία εμφανίστηκε ο Βολοντίμιρ Ζελένσκι. 	ΠΟΛΕΜΟΣ ΣΤΗΝ ΟΥΚΡΑΝΙΑ	2022	Μαρτίου	09	22:08	2022-03-09 22:08:00
354	Ουκρανία: Ο Ζελένσκι καταγγέλλει ρωσικό βομβαρδισμό σε νοσοκομείο Παίδων στη Μαριούπολη	09 Μαρτίου 2022 19:08	https://www.news247.gr/kosmos/oykrania-o-zelenski-kataggellei-rosiko-vomvardismo-se-nosokomeio-paidon-sti-marioypoli.9556496.html	"Αεροπορική επιδρομή των ρωσικών δυνάμεων σε νοσοκομείο Παίδων στη Μαριούπολη, καταγγέλλει ο Βολοντίμιρ Ζελένσκι. Τα παιδιά βρίσκονται ""κάτω από τα συντρίμμια""."	ΠΟΛΕΜΟΣ ΣΤΗΝ ΟΥΚΡΑΝΙΑ	2022	Μαρτίου	09	19:08	2022-03-09 19:08:00
355	"Ζελένσκι: Στα χέρια της Δύσης η απόφαση για τα MiG-29 - ""Στείλτε μας αεροπλάνα"""	09 Μαρτίου 2022 15:27	https://www.news247.gr/kosmos/zelenski-sta-cheria-tis-dysis-i-apofasi-gia-ta-mig-29-steilte-mas-aeroplana.9556263.html	Ο Ουκρανός πρόεδρος απηύθυνε έκκληση προς τη Δύση να αποφασίσει το συντομότερο δυνατό για την αποστολή αεροσκαφών MiG-29.	ΠΟΛΕΜΟΣ ΣΤΗΝ ΟΥΚΡΑΝΙΑ	2022	Μαρτίου	09	15:27	2022-03-09 15:27:00
356	Πόλεμος στην Ουκρανία: Εντείνονται οι μάχες - Νέα νύχτα αγωνίας για το Κίεβο	08 Μαρτίου 2022 22:56	https://www.news247.gr/kosmos/polemos-stin-oykrania-enteinontai-oi-maches-fovoi-oti-oi-rosoi-tha-mpoyn-sto-kievo.9555465.html	Ιδιαίτερα κρίσιμη η κατάσταση στην Ουκρανία. Ρωσική φάλαγγα προωθείται στο Κίεβο από τα βορειοανατολικά. Νέα κατάπαυση πυρός για την απομάκρυνση αμάχων ανακοίνωσε η Μόσχα.	ΠΟΛΕΜΟΣ ΣΤΗΝ ΟΥΚΡΑΝΙΑ	2022	Μαρτίου	08	22:56	2022-03-08 22:56:00
357	"Ζελένσκι: ""Ευγνώμων στις ΗΠΑ για το χτύπημα στην καρδιά της πολεμικής μηχανής του Πούτιν"""	08 Μαρτίου 2022 22:24	https://www.news247.gr/kosmos/zelenski-eygnomon-stis-ipa-gia-to-chtypima-stin-kardia-tis-polemikis-michanis-toy-poytin.9555470.html	Σε νέα του ανάρτηση, ο Βολοντίμιρ Ζελένσκι ευχαριστεί τις ΗΠΑ, αλλά και τον Μπάιντεν προσωπικά, για την απόφασή του να απαγορεύσει την εισαγωγή ρωσικού πετρελαίου.	ΠΟΛΕΜΟΣ ΣΤΗΝ ΟΥΚΡΑΝΙΑ	2022	Μαρτίου	08	22:24	2022-03-08 22:24:00
358	"ΗΠΑ - μυστικές υπηρεσίες για Ουκρανία: ""Άσχημες οι επόμενες εβδομάδες"""	08 Μαρτίου 2022 20:37	https://www.news247.gr/kosmos/ipa-mystikes-ypiresies-gia-oykrania-aschimes-oi-epomenes-evdomades.9555373.html	"Οι αμερικανικές μυστικές υπηρεσίες εκτιμούν ότι ο Πούτιν ενδέχεται να κλιμακώσει την επίθεση στην Ουκρανία και ""οι επόμενες εβδομάδες θα είναι άσχημες""."	ΠΟΛΕΜΟΣ ΣΤΗΝ ΟΥΚΡΑΝΙΑ	2022	Μαρτίου	08	20:37	2022-03-08 20:37:00
359	"Ζελένσκι: ""Θα συνεχίσουμε να αγωνιζόμαστε για τη γη μας, όποιο κι αν είναι το κόστος"""	08 Μαρτίου 2022 19:59	https://www.news247.gr/kosmos/zelenski-tha-synechisoyme-na-agonizomaste-gia-ti-gi-mas-opoio-ki-an-einai-to-kostos.9555352.html	"Αποθέωση του Ζελένσκι από το βρετανικό κοινοβούλιο. Έκκληση για περαιτέρω βοήθεια στην Ουκρανία, η οποία ""θα συνεχίσει να αντιστέκεται""."	ΠΟΛΕΜΟΣ ΣΤΗΝ ΟΥΚΡΑΝΙΑ	2022	Μαρτίου	08	19:59	2022-03-08 19:59:00
